too long...

root@comp3134-Winter2023:~# 20:29:02.771708 IP 159.203.27.150.22 > 99.230.69.122.59547: Flags [P.], seq 610192:610348, ack 325, win 570, length 156
20:29:02.771796 IP 159.203.27.150.22 > 99.230.69.122.59547: Flags [P.], seq 610348:610504, ack 325, win 570, length 156
20:29:02.771848 IP 159.203.27.150.22 > 99.230.69.122.59547: Flags [P.], seq 610504:610660, ack 325, win 570, length 156
20:29:02.771887 IP 159.203.27.150.22 > 99.230.69.122.59547: Flags [P.], seq 610660:610816, ack 325, win 570, length 156
20:29:02.771940 IP 159.203.27.150.22 > 99.230.69.122.59547: Flags [P.], seq 610816:610972, ack 325, win 570, length 156
20:29:02.771991 IP 159.203.27.150.22 > 99.230.69.122.59547: Flags [P.], seq 610972:611128, ack 325, win 570, length 156
20:29:02.772036 IP 159.203.27.150.22 > 99.230.69.122.59547: Flags [P.], seq 611128:611284, ack 325, win 570, length 156
20:29:02.772083 IP 159.203.27.150.22 > 99.230.69.122.59547: Flags [P.], seq 611284:611440, ack 325, win 570, length 156
20:29:02.772302 IP 159.203.27.150.22 > 99.230.69.122.59547: Flags [P.], seq 611440:611596, ack 325, win 570, length 156
20:29:02.772420 IP 159.203.27.150.22 > 99.230.69.122.59547: Flags [P.], seq 611596:611752, ack 325, win 570, length 156
20:29:02.772463 IP 159.203.27.150.22 > 99.230.69.122.59547: Flags [P.], seq 611752:611908, ack 325, win 570, length 156
20:29:02.772702 IP 159.203.27.150.22 > 99.230.69.122.59547: Flags [P.], seq 611908:612064, ack 325, win 570, length 156
20:29:02.772973 IP 159.203.27.150.22 > 99.230.69.122.59547: Flags [P.], seq 612064:612220, ack 325, win 570, length 156
20:29:02.773335 IP 159.203.27.150.22 > 99.230.69.122.59547: Flags [P.], seq 612220:612376, ack 325, win 570, length 156
20:29:02.773447 IP 159.203.27.150.22 > 99.230.69.122.59547: Flags [P.], seq 612376:612532, ack 325, win 570, length 156
20:29:02.773493 IP 159.203.27.150.22 > 99.230.69.122.59547: Flags [P.], seq 612532:612688, ack 325, win 570, length 156
20:29:02.773545 IP 159.203.27.150.22 > 99.230.69.122.59547: Flags [P.], seq 612688:612844, ack 325, win 570, length 156
20:29:02.773597 IP 159.203.27.150.22 > 99.230.69.122.59547: Flags [P.], seq 612844:613000, ack 325, win 570, length 156
20:29:02.773650 IP 159.203.27.150.22 > 99.230.69.122.59547: Flags [P.], seq 613000:613156, ack 325, win 570, length 156
20:29:02.773705 IP 159.203.27.150.22 > 99.230.69.122.59547: Flags [P.], seq 613156:613312, ack 325, win 570, length 156
20:29:02.773760 IP 159.203.27.150.22 > 99.230.69.122.59547: Flags [P.], seq 613312:613468, ack 325, win 570, length 156
20:29:02.773805 IP 159.203.27.150.22 > 99.230.69.122.59547: Flags [P.], seq 613468:613624, ack 325, win 570, length 156
20:29:02.773842 IP 159.203.27.150.22 > 99.230.69.122.59547: Flags [P.], seq 613624:613780, ack 325, win 570, length 156
20:29:02.773886 IP 159.203.27.150.22 > 99.230.69.122.59547: Flags [P.], seq 613780:613936, ack 325, win 570, length 156
20:29:02.773936 IP 159.203.27.150.22 > 99.230.69.122.59547: Flags [P.], seq 613936:614092, ack 325, win 570, length 156
20:29:02.774003 IP 159.203.27.150.22 > 99.230.69.122.59547: Flags [P.], seq 614092:614248, ack 325, win 570, length 156
20:29:02.774055 IP 159.203.27.150.22 > 99.230.69.122.59547: Flags [P.], seq 614248:614404, ack 325, win 570, length 156
20:29:02.774110 IP 159.203.27.150.22 > 99.230.69.122.59547: Flags [P.], seq 614404:614560, ack 325, win 570, length 156
20:29:02.774328 IP 159.203.27.150.22 > 99.230.69.122.59547: Flags [P.], seq 614560:614716, ack 325, win 570, length 156
20:29:02.774441 IP 159.203.27.150.22 > 99.230.69.122.59547: Flags [P.], seq 614716:614872, ack 325, win 570, length 156
20:29:02.774509 IP 159.203.27.150.22 > 99.230.69.122.59547: Flags [P.], seq 614872:615028, ack 325, win 570, length 156
20:29:02.774566 IP 159.203.27.150.22 > 99.230.69.122.59547: Flags [P.], seq 615028:615184, ack 325, win 570, length 156
20:29:02.774618 IP 159.203.27.150.22 > 99.230.69.122.59547: Flags [P.], seq 615184:615340, ack 325, win 570, length 156
20:29:02.774687 IP 159.203.27.150.22 > 99.230.69.122.59547: Flags [P.], seq 615340:615496, ack 325, win 570, length 156
20:29:02.774737 IP 159.203.27.150.22 > 99.230.69.122.59547: Flags [P.], seq 615496:615652, ack 325, win 570, length 156
20:29:02.774787 IP 159.203.27.150.22 > 99.230.69.122.59547: Flags [P.], seq 615652:615808, ack 325, win 570, length 156
20:29:02.774834 IP 159.203.27.150.22 > 99.230.69.122.59547: Flags [P.], seq 615808:615964, ack 325, win 570, length 156
20:29:02.774882 IP 159.203.27.150.22 > 99.230.69.122.59547: Flags [P.], seq 615964:616120, ack 325, win 570, length 156
20:29:02.774936 IP 159.203.27.150.22 > 99.230.69.122.59547: Flags [P.], seq 616120:616276, ack 325, win 570, length 156
20:29:02.774983 IP 159.203.27.150.22 > 99.230.69.122.59547: Flags [P.], seq 616276:616432, ack 325, win 570, length 156
20:29:02.775030 IP 159.203.27.150.22 > 99.230.69.122.59547: Flags [P.], seq 616432:616588, ack 325, win 570, length 156
20:29:02.775076 IP 159.203.27.150.22 > 99.230.69.122.59547: Flags [P.], seq 616588:616744, ack 325, win 570, length 156
20:29:02.775123 IP 159.203.27.150.22 > 99.230.69.122.59547: Flags [P.], seq 616744:616900, ack 325, win 570, length 156
20:29:02.775170 IP 159.203.27.150.22 > 99.230.69.122.59547: Flags [P.], seq 616900:617056, ack 325, win 570, length 156
20:29:02.775698 IP 99.230.69.122.59547 > 159.203.27.150.22: Flags [.], ack 589844, win 17976, length 0
20:29:02.775744 IP 159.203.27.150.22 > 99.230.69.122.59547: Flags [P.], seq 617056:617212, ack 325, win 570, length 156
20:29:02.775872 IP 159.203.27.150.22 > 99.230.69.122.59547: Flags [P.], seq 617212:617472, ack 325, win 570, length 260
20:29:02.775926 IP 159.203.27.150.22 > 99.230.69.122.59547: Flags [P.], seq 617472:617628, ack 325, win 570, length 156
20:29:02.775971 IP 159.203.27.150.22 > 99.230.69.122.59547: Flags [P.], seq 617628:617784, ack 325, win 570, length 156
20:29:02.776016 IP 159.203.27.150.22 > 99.230.69.122.59547: Flags [P.], seq 617784:617940, ack 325, win 570, length 156
20:29:02.776225 IP 159.203.27.150.22 > 99.230.69.122.59547: Flags [P.], seq 617940:618096, ack 325, win 570, length 156
20:29:02.776288 IP 159.203.27.150.22 > 99.230.69.122.59547: Flags [P.], seq 618096:618252, ack 325, win 570, length 156
20:29:02.776346 IP 159.203.27.150.22 > 99.230.69.122.59547: Flags [P.], seq 618252:618408, ack 325, win 570, length 156
20:29:02.776395 IP 159.203.27.150.22 > 99.230.69.122.59547: Flags [P.], seq 618408:618564, ack 325, win 570, length 156
20:29:02.776440 IP 159.203.27.150.22 > 99.230.69.122.59547: Flags [P.], seq 618564:618720, ack 325, win 570, length 156
20:29:02.776564 IP 159.203.27.150.22 > 99.230.69.122.59547: Flags [P.], seq 618720:618876, ack 325, win 570, length 156
20:29:02.776748 IP 159.203.27.150.22 > 99.230.69.122.59547: Flags [P.], seq 618876:619032, ack 325, win 570, length 156
20:29:02.776814 IP 159.203.27.150.22 > 99.230.69.122.59547: Flags [P.], seq 619032:619188, ack 325, win 570, length 156
20:29:02.776865 IP 159.203.27.150.22 > 99.230.69.122.59547: Flags [P.], seq 619188:619344, ack 325, win 570, length 156
20:29:02.776915 IP 159.203.27.150.22 > 99.230.69.122.59547: Flags [P.], seq 619344:619500, ack 325, win 570, length 156
20:29:02.776962 IP 159.203.27.150.22 > 99.230.69.122.59547: Flags [P.], seq 619500:619656, ack 325, win 570, length 156
20:29:02.777037 IP 159.203.27.150.22 > 99.230.69.122.59547: Flags [P.], seq 619656:619812, ack 325, win 570, length 156
20:29:02.777100 IP 159.203.27.150.22 > 99.230.69.122.59547: Flags [P.], seq 619812:619968, ack 325, win 570, length 156
20:29:02.777153 IP 159.203.27.150.22 > 99.230.69.122.59547: Flags [P.], seq 619968:620124, ack 325, win 570, length 156
20:29:02.777209 IP 159.203.27.150.22 > 99.230.69.122.59547: Flags [P.], seq 620124:620280, ack 325, win 570, length 156
20:29:02.777450 IP 159.203.27.150.22 > 99.230.69.122.59547: Flags [P.], seq 620280:620436, ack 325, win 570, length 156
20:29:02.777517 IP 159.203.27.150.22 > 99.230.69.122.59547: Flags [P.], seq 620436:620592, ack 325, win 570, length 156
20:29:02.777574 IP 159.203.27.150.22 > 99.230.69.122.59547: Flags [P.], seq 620592:620748, ack 325, win 570, length 156
20:29:02.777631 IP 159.203.27.150.22 > 99.230.69.122.59547: Flags [P.], seq 620748:620904, ack 325, win 570, length 156
20:29:02.777696 IP 159.203.27.150.22 > 99.230.69.122.59547: Flags [P.], seq 620904:621060, ack 325, win 570, length 156
20:29:02.777783 IP 159.203.27.150.22 > 99.230.69.122.59547: Flags [P.], seq 621060:621216, ack 325, win 570, length 156
20:29:02.777844 IP 159.203.27.150.22 > 99.230.69.122.59547: Flags [P.], seq 621216:621372, ack 325, win 570, length 156
20:29:02.777902 IP 159.203.27.150.22 > 99.230.69.122.59547: Flags [P.], seq 621372:621528, ack 325, win 570, length 156
20:29:02.777960 IP 159.203.27.150.22 > 99.230.69.122.59547: Flags [P.], seq 621528:621684, ack 325, win 570, length 156
20:29:02.778015 IP 159.203.27.150.22 > 99.230.69.122.59547: Flags [P.], seq 621684:621840, ack 325, win 570, length 156
20:29:02.778068 IP 159.203.27.150.22 > 99.230.69.122.59547: Flags [P.], seq 621840:621996, ack 325, win 570, length 156
20:29:02.778321 IP 159.203.27.150.22 > 99.230.69.122.59547: Flags [P.], seq 621996:622152, ack 325, win 570, length 156
20:29:02.778397 IP 159.203.27.150.22 > 99.230.69.122.59547: Flags [P.], seq 622152:622308, ack 325, win 570, length 156
20:29:02.778457 IP 159.203.27.150.22 > 99.230.69.122.59547: Flags [P.], seq 622308:622464, ack 325, win 570, length 156
20:29:02.778521 IP 159.203.27.150.22 > 99.230.69.122.59547: Flags [P.], seq 622464:622620, ack 325, win 570, length 156
20:29:02.778576 IP 159.203.27.150.22 > 99.230.69.122.59547: Flags [P.], seq 622620:622776, ack 325, win 570, length 156
20:29:02.778628 IP 159.203.27.150.22 > 99.230.69.122.59547: Flags [P.], seq 622776:622932, ack 325, win 570, length 156
20:29:02.779107 IP 159.203.27.150.22 > 99.230.69.122.59547: Flags [P.], seq 622932:623088, ack 325, win 570, length 156
20:29:02.779217 IP 159.203.27.150.22 > 99.230.69.122.59547: Flags [P.], seq 623088:623244, ack 325, win 570, length 156
20:29:02.779276 IP 159.203.27.150.22 > 99.230.69.122.59547: Flags [P.], seq 623244:623400, ack 325, win 570, length 156
20:29:02.779332 IP 159.203.27.150.22 > 99.230.69.122.59547: Flags [P.], seq 623400:623556, ack 325, win 570, length 156
20:29:02.779390 IP 159.203.27.150.22 > 99.230.69.122.59547: Flags [P.], seq 623556:623712, ack 325, win 570, length 156
20:29:02.779444 IP 159.203.27.150.22 > 99.230.69.122.59547: Flags [P.], seq 623712:623868, ack 325, win 570, length 156
20:29:02.779496 IP 159.203.27.150.22 > 99.230.69.122.59547: Flags [P.], seq 623868:624024, ack 325, win 570, length 156
20:29:02.779559 IP 159.203.27.150.22 > 99.230.69.122.59547: Flags [P.], seq 624024:624180, ack 325, win 570, length 156
20:29:02.779612 IP 159.203.27.150.22 > 99.230.69.122.59547: Flags [P.], seq 624180:624336, ack 325, win 570, length 156
20:29:02.779672 IP 159.203.27.150.22 > 99.230.69.122.59547: Flags [P.], seq 624336:624492, ack 325, win 570, length 156
20:29:02.779733 IP 159.203.27.150.22 > 99.230.69.122.59547: Flags [P.], seq 624492:624648, ack 325, win 570, length 156
20:29:02.779788 IP 159.203.27.150.22 > 99.230.69.122.59547: Flags [P.], seq 624648:624804, ack 325, win 570, length 156
20:29:02.779842 IP 159.203.27.150.22 > 99.230.69.122.59547: Flags [P.], seq 624804:624960, ack 325, win 570, length 156
20:29:02.779897 IP 159.203.27.150.22 > 99.230.69.122.59547: Flags [P.], seq 624960:625116, ack 325, win 570, length 156
20:29:02.779950 IP 159.203.27.150.22 > 99.230.69.122.59547: Flags [P.], seq 625116:625272, ack 325, win 570, length 156
20:29:02.780009 IP 159.203.27.150.22 > 99.230.69.122.59547: Flags [P.], seq 625272:625428, ack 325, win 570, length 156
20:29:02.780065 IP 159.203.27.150.22 > 99.230.69.122.59547: Flags [P.], seq 625428:625584, ack 325, win 570, length 156
20:29:02.780123 IP 159.203.27.150.22 > 99.230.69.122.59547: Flags [P.], seq 625584:625740, ack 325, win 570, length 156
20:29:02.780188 IP 159.203.27.150.22 > 99.230.69.122.59547: Flags [P.], seq 625740:625896, ack 325, win 570, length 156
20:29:02.780412 IP 159.203.27.150.22 > 99.230.69.122.59547: Flags [P.], seq 625896:626052, ack 325, win 570, length 156
20:29:02.780611 IP 159.203.27.150.22 > 99.230.69.122.59547: Flags [P.], seq 626052:626208, ack 325, win 570, length 156
20:29:02.780695 IP 159.203.27.150.22 > 99.230.69.122.59547: Flags [P.], seq 626208:626364, ack 325, win 570, length 156
20:29:02.780946 IP 159.203.27.150.22 > 99.230.69.122.59547: Flags [P.], seq 626364:626520, ack 325, win 570, length 156
20:29:02.781010 IP 159.203.27.150.22 > 99.230.69.122.59547: Flags [P.], seq 626520:626676, ack 325, win 570, length 156
20:29:02.781183 IP 159.203.27.150.22 > 99.230.69.122.59547: Flags [P.], seq 626676:626832, ack 325, win 570, length 156
20:29:02.781250 IP 159.203.27.150.22 > 99.230.69.122.59547: Flags [P.], seq 626832:626988, ack 325, win 570, length 156
20:29:02.781303 IP 159.203.27.150.22 > 99.230.69.122.59547: Flags [P.], seq 626988:627144, ack 325, win 570, length 156
20:29:02.781350 IP 159.203.27.150.22 > 99.230.69.122.59547: Flags [P.], seq 627144:627300, ack 325, win 570, length 156
20:29:02.781398 IP 159.203.27.150.22 > 99.230.69.122.59547: Flags [P.], seq 627300:627456, ack 325, win 570, length 156
20:29:02.781446 IP 159.203.27.150.22 > 99.230.69.122.59547: Flags [P.], seq 627456:627612, ack 325, win 570, length 156
20:29:02.781582 IP 159.203.27.150.22 > 99.230.69.122.59547: Flags [P.], seq 627612:627768, ack 325, win 570, length 156
20:29:02.781648 IP 159.203.27.150.22 > 99.230.69.122.59547: Flags [P.], seq 627768:627924, ack 325, win 570, length 156
20:29:02.781702 IP 159.203.27.150.22 > 99.230.69.122.59547: Flags [P.], seq 627924:628080, ack 325, win 570, length 156
20:29:02.781751 IP 159.203.27.150.22 > 99.230.69.122.59547: Flags [P.], seq 628080:628236, ack 325, win 570, length 156
20:29:02.781802 IP 159.203.27.150.22 > 99.230.69.122.59547: Flags [P.], seq 628236:628392, ack 325, win 570, length 156
20:29:02.781866 IP 159.203.27.150.22 > 99.230.69.122.59547: Flags [P.], seq 628392:628548, ack 325, win 570, length 156
20:29:02.781936 IP 159.203.27.150.22 > 99.230.69.122.59547: Flags [P.], seq 628548:628704, ack 325, win 570, length 156
20:29:02.782092 IP 159.203.27.150.22 > 99.230.69.122.59547: Flags [P.], seq 628704:628860, ack 325, win 570, length 156
20:29:02.782145 IP 159.203.27.150.22 > 99.230.69.122.59547: Flags [P.], seq 628860:629016, ack 325, win 570, length 156
20:29:02.782338 IP 159.203.27.150.22 > 99.230.69.122.59547: Flags [P.], seq 629016:629172, ack 325, win 570, length 156
20:29:02.782407 IP 159.203.27.150.22 > 99.230.69.122.59547: Flags [P.], seq 629172:629328, ack 325, win 570, length 156
20:29:02.782461 IP 159.203.27.150.22 > 99.230.69.122.59547: Flags [P.], seq 629328:629484, ack 325, win 570, length 156
20:29:02.782512 IP 159.203.27.150.22 > 99.230.69.122.59547: Flags [P.], seq 629484:629640, ack 325, win 570, length 156
20:29:02.782568 IP 159.203.27.150.22 > 99.230.69.122.59547: Flags [P.], seq 629640:629796, ack 325, win 570, length 156
20:29:02.782618 IP 159.203.27.150.22 > 99.230.69.122.59547: Flags [P.], seq 629796:629952, ack 325, win 570, length 156
20:29:02.782679 IP 159.203.27.150.22 > 99.230.69.122.59547: Flags [P.], seq 629952:630108, ack 325, win 570, length 156
20:29:02.782729 IP 159.203.27.150.22 > 99.230.69.122.59547: Flags [P.], seq 630108:630264, ack 325, win 570, length 156
20:29:02.782780 IP 159.203.27.150.22 > 99.230.69.122.59547: Flags [P.], seq 630264:630420, ack 325, win 570, length 156
20:29:02.782830 IP 159.203.27.150.22 > 99.230.69.122.59547: Flags [P.], seq 630420:630576, ack 325, win 570, length 156
20:29:02.782880 IP 159.203.27.150.22 > 99.230.69.122.59547: Flags [P.], seq 630576:630732, ack 325, win 570, length 156
20:29:02.782928 IP 159.203.27.150.22 > 99.230.69.122.59547: Flags [P.], seq 630732:630888, ack 325, win 570, length 156
20:29:02.782975 IP 159.203.27.150.22 > 99.230.69.122.59547: Flags [P.], seq 630888:631044, ack 325, win 570, length 156
20:29:02.783020 IP 159.203.27.150.22 > 99.230.69.122.59547: Flags [P.], seq 631044:631200, ack 325, win 570, length 156
20:29:02.783068 IP 159.203.27.150.22 > 99.230.69.122.59547: Flags [P.], seq 631200:631356, ack 325, win 570, length 156
20:29:02.783120 IP 159.203.27.150.22 > 99.230.69.122.59547: Flags [P.], seq 631356:631512, ack 325, win 570, length 156
20:29:02.783854 IP 99.230.69.122.59547 > 159.203.27.150.22: Flags [.], ack 591196, win 17970, length 0
20:29:02.783854 IP 99.230.69.122.59547 > 159.203.27.150.22: Flags [.], ack 596344, win 17976, length 0
20:29:02.783854 IP 99.230.69.122.59547 > 159.203.27.150.22: Flags [.], ack 602272, win 17976, length 0
20:29:02.783899 IP 159.203.27.150.22 > 99.230.69.122.59547: Flags [P.], seq 631512:631668, ack 325, win 570, length 156
20:29:02.784092 IP 159.203.27.150.22 > 99.230.69.122.59547: Flags [P.], seq 631668:632136, ack 325, win 570, length 468
20:29:02.784153 IP 159.203.27.150.22 > 99.230.69.122.59547: Flags [P.], seq 632136:632292, ack 325, win 570, length 156
20:29:02.784206 IP 159.203.27.150.22 > 99.230.69.122.59547: Flags [P.], seq 632292:632448, ack 325, win 570, length 156
20:29:02.784255 IP 159.203.27.150.22 > 99.230.69.122.59547: Flags [P.], seq 632448:632604, ack 325, win 570, length 156
20:29:02.784306 IP 159.203.27.150.22 > 99.230.69.122.59547: Flags [P.], seq 632604:632760, ack 325, win 570, length 156
20:29:02.784356 IP 159.203.27.150.22 > 99.230.69.122.59547: Flags [P.], seq 632760:632916, ack 325, win 570, length 156
20:29:02.784405 IP 159.203.27.150.22 > 99.230.69.122.59547: Flags [P.], seq 632916:633072, ack 325, win 570, length 156
20:29:02.784453 IP 159.203.27.150.22 > 99.230.69.122.59547: Flags [P.], seq 633072:633228, ack 325, win 570, length 156
20:29:02.784573 IP 159.203.27.150.22 > 99.230.69.122.59547: Flags [P.], seq 633228:633384, ack 325, win 570, length 156
20:29:02.784638 IP 159.203.27.150.22 > 99.230.69.122.59547: Flags [P.], seq 633384:633540, ack 325, win 570, length 156
20:29:02.784689 IP 159.203.27.150.22 > 99.230.69.122.59547: Flags [P.], seq 633540:633696, ack 325, win 570, length 156
20:29:02.784840 IP 159.203.27.150.22 > 99.230.69.122.59547: Flags [P.], seq 633696:633852, ack 325, win 570, length 156
20:29:02.784894 IP 159.203.27.150.22 > 99.230.69.122.59547: Flags [P.], seq 633852:634008, ack 325, win 570, length 156
20:29:02.784942 IP 159.203.27.150.22 > 99.230.69.122.59547: Flags [P.], seq 634008:634164, ack 325, win 570, length 156
20:29:02.784997 IP 159.203.27.150.22 > 99.230.69.122.59547: Flags [P.], seq 634164:634320, ack 325, win 570, length 156
20:29:02.785166 IP 159.203.27.150.22 > 99.230.69.122.59547: Flags [P.], seq 634320:634476, ack 325, win 570, length 156
20:29:02.785223 IP 159.203.27.150.22 > 99.230.69.122.59547: Flags [P.], seq 634476:634632, ack 325, win 570, length 156
20:29:02.785270 IP 159.203.27.150.22 > 99.230.69.122.59547: Flags [P.], seq 634632:634788, ack 325, win 570, length 156
20:29:02.785320 IP 159.203.27.150.22 > 99.230.69.122.59547: Flags [P.], seq 634788:634944, ack 325, win 570, length 156
20:29:02.785372 IP 159.203.27.150.22 > 99.230.69.122.59547: Flags [P.], seq 634944:635100, ack 325, win 570, length 156
20:29:02.785423 IP 159.203.27.150.22 > 99.230.69.122.59547: Flags [P.], seq 635100:635256, ack 325, win 570, length 156
20:29:02.785471 IP 159.203.27.150.22 > 99.230.69.122.59547: Flags [P.], seq 635256:635412, ack 325, win 570, length 156
20:29:02.785523 IP 159.203.27.150.22 > 99.230.69.122.59547: Flags [P.], seq 635412:635568, ack 325, win 570, length 156
20:29:02.785572 IP 159.203.27.150.22 > 99.230.69.122.59547: Flags [P.], seq 635568:635724, ack 325, win 570, length 156
20:29:02.785794 IP 159.203.27.150.22 > 99.230.69.122.59547: Flags [P.], seq 635724:635880, ack 325, win 570, length 156
20:29:02.785845 IP 159.203.27.150.22 > 99.230.69.122.59547: Flags [P.], seq 635880:636036, ack 325, win 570, length 156
20:29:02.785897 IP 159.203.27.150.22 > 99.230.69.122.59547: Flags [P.], seq 636036:636192, ack 325, win 570, length 156
20:29:02.785947 IP 159.203.27.150.22 > 99.230.69.122.59547: Flags [P.], seq 636192:636348, ack 325, win 570, length 156
20:29:02.785998 IP 159.203.27.150.22 > 99.230.69.122.59547: Flags [P.], seq 636348:636504, ack 325, win 570, length 156
20:29:02.786048 IP 159.203.27.150.22 > 99.230.69.122.59547: Flags [P.], seq 636504:636660, ack 325, win 570, length 156
20:29:02.786132 IP 159.203.27.150.22 > 99.230.69.122.59547: Flags [P.], seq 636660:636816, ack 325, win 570, length 156
20:29:02.786185 IP 159.203.27.150.22 > 99.230.69.122.59547: Flags [P.], seq 636816:636972, ack 325, win 570, length 156
20:29:02.786237 IP 159.203.27.150.22 > 99.230.69.122.59547: Flags [P.], seq 636972:637128, ack 325, win 570, length 156
20:29:02.786293 IP 159.203.27.150.22 > 99.230.69.122.59547: Flags [P.], seq 637128:637284, ack 325, win 570, length 156
20:29:02.786343 IP 159.203.27.150.22 > 99.230.69.122.59547: Flags [P.], seq 637284:637440, ack 325, win 570, length 156
20:29:02.786392 IP 159.203.27.150.22 > 99.230.69.122.59547: Flags [P.], seq 637440:637596, ack 325, win 570, length 156
20:29:02.786442 IP 159.203.27.150.22 > 99.230.69.122.59547: Flags [P.], seq 637596:637752, ack 325, win 570, length 156
20:29:02.786492 IP 159.203.27.150.22 > 99.230.69.122.59547: Flags [P.], seq 637752:637908, ack 325, win 570, length 156
20:29:02.786541 IP 159.203.27.150.22 > 99.230.69.122.59547: Flags [P.], seq 637908:638064, ack 325, win 570, length 156
20:29:02.786593 IP 159.203.27.150.22 > 99.230.69.122.59547: Flags [P.], seq 638064:638220, ack 325, win 570, length 156
20:29:02.786652 IP 159.203.27.150.22 > 99.230.69.122.59547: Flags [P.], seq 638220:638376, ack 325, win 570, length 156
20:29:02.786720 IP 159.203.27.150.22 > 99.230.69.122.59547: Flags [P.], seq 638376:638532, ack 325, win 570, length 156
20:29:02.786771 IP 159.203.27.150.22 > 99.230.69.122.59547: Flags [P.], seq 638532:638688, ack 325, win 570, length 156
20:29:02.786821 IP 159.203.27.150.22 > 99.230.69.122.59547: Flags [P.], seq 638688:638844, ack 325, win 570, length 156
20:29:02.786873 IP 159.203.27.150.22 > 99.230.69.122.59547: Flags [P.], seq 638844:639000, ack 325, win 570, length 156
20:29:02.786925 IP 159.203.27.150.22 > 99.230.69.122.59547: Flags [P.], seq 639000:639156, ack 325, win 570, length 156
20:29:02.786976 IP 159.203.27.150.22 > 99.230.69.122.59547: Flags [P.], seq 639156:639312, ack 325, win 570, length 156
20:29:02.787027 IP 159.203.27.150.22 > 99.230.69.122.59547: Flags [P.], seq 639312:639468, ack 325, win 570, length 156
20:29:02.787078 IP 159.203.27.150.22 > 99.230.69.122.59547: Flags [P.], seq 639468:639624, ack 325, win 570, length 156
20:29:02.787125 IP 159.203.27.150.22 > 99.230.69.122.59547: Flags [P.], seq 639624:639780, ack 325, win 570, length 156
20:29:02.787175 IP 159.203.27.150.22 > 99.230.69.122.59547: Flags [P.], seq 639780:639936, ack 325, win 570, length 156
20:29:02.787223 IP 159.203.27.150.22 > 99.230.69.122.59547: Flags [P.], seq 639936:640092, ack 325, win 570, length 156
20:29:02.787272 IP 159.203.27.150.22 > 99.230.69.122.59547: Flags [P.], seq 640092:640248, ack 325, win 570, length 156
20:29:02.787319 IP 159.203.27.150.22 > 99.230.69.122.59547: Flags [P.], seq 640248:640404, ack 325, win 570, length 156
20:29:02.787590 IP 159.203.27.150.22 > 99.230.69.122.59547: Flags [P.], seq 640404:640560, ack 325, win 570, length 156
20:29:02.787668 IP 159.203.27.150.22 > 99.230.69.122.59547: Flags [P.], seq 640560:640716, ack 325, win 570, length 156
20:29:02.787733 IP 159.203.27.150.22 > 99.230.69.122.59547: Flags [P.], seq 640716:640872, ack 325, win 570, length 156
20:29:02.787784 IP 159.203.27.150.22 > 99.230.69.122.59547: Flags [P.], seq 640872:641028, ack 325, win 570, length 156
20:29:02.787830 IP 159.203.27.150.22 > 99.230.69.122.59547: Flags [P.], seq 641028:641184, ack 325, win 570, length 156
20:29:02.787876 IP 159.203.27.150.22 > 99.230.69.122.59547: Flags [P.], seq 641184:641340, ack 325, win 570, length 156
20:29:02.787970 IP 159.203.27.150.22 > 99.230.69.122.59547: Flags [P.], seq 641340:641496, ack 325, win 570, length 156
20:29:02.788028 IP 159.203.27.150.22 > 99.230.69.122.59547: Flags [P.], seq 641496:641652, ack 325, win 570, length 156
20:29:02.788105 IP 159.203.27.150.22 > 99.230.69.122.59547: Flags [P.], seq 641652:641808, ack 325, win 570, length 156
20:29:02.788186 IP 159.203.27.150.22 > 99.230.69.122.59547: Flags [P.], seq 641808:641964, ack 325, win 570, length 156
20:29:02.788239 IP 159.203.27.150.22 > 99.230.69.122.59547: Flags [P.], seq 641964:642120, ack 325, win 570, length 156
20:29:02.788288 IP 159.203.27.150.22 > 99.230.69.122.59547: Flags [P.], seq 642120:642276, ack 325, win 570, length 156
20:29:02.788353 IP 159.203.27.150.22 > 99.230.69.122.59547: Flags [P.], seq 642276:642432, ack 325, win 570, length 156
20:29:02.788402 IP 159.203.27.150.22 > 99.230.69.122.59547: Flags [P.], seq 642432:642588, ack 325, win 570, length 156
20:29:02.788460 IP 159.203.27.150.22 > 99.230.69.122.59547: Flags [P.], seq 642588:642744, ack 325, win 570, length 156
20:29:02.788578 IP 159.203.27.150.22 > 99.230.69.122.59547: Flags [P.], seq 642744:642900, ack 325, win 570, length 156
20:29:02.788636 IP 159.203.27.150.22 > 99.230.69.122.59547: Flags [P.], seq 642900:643056, ack 325, win 570, length 156
20:29:02.788713 IP 159.203.27.150.22 > 99.230.69.122.59547: Flags [P.], seq 643056:643212, ack 325, win 570, length 156
20:29:02.788764 IP 159.203.27.150.22 > 99.230.69.122.59547: Flags [P.], seq 643212:643368, ack 325, win 570, length 156
20:29:02.788813 IP 159.203.27.150.22 > 99.230.69.122.59547: Flags [P.], seq 643368:643524, ack 325, win 570, length 156
20:29:02.788859 IP 159.203.27.150.22 > 99.230.69.122.59547: Flags [P.], seq 643524:643680, ack 325, win 570, length 156
20:29:02.788905 IP 159.203.27.150.22 > 99.230.69.122.59547: Flags [P.], seq 643680:643836, ack 325, win 570, length 156
20:29:02.788957 IP 159.203.27.150.22 > 99.230.69.122.59547: Flags [P.], seq 643836:643992, ack 325, win 570, length 156
20:29:02.789004 IP 159.203.27.150.22 > 99.230.69.122.59547: Flags [P.], seq 643992:644148, ack 325, win 570, length 156
20:29:02.789049 IP 159.203.27.150.22 > 99.230.69.122.59547: Flags [P.], seq 644148:644304, ack 325, win 570, length 156
20:29:02.789112 IP 159.203.27.150.22 > 99.230.69.122.59547: Flags [P.], seq 644304:644460, ack 325, win 570, length 156
20:29:02.789227 IP 159.203.27.150.22 > 99.230.69.122.59547: Flags [P.], seq 644460:644616, ack 325, win 570, length 156
20:29:02.789280 IP 159.203.27.150.22 > 99.230.69.122.59547: Flags [P.], seq 644616:644772, ack 325, win 570, length 156
20:29:02.789326 IP 159.203.27.150.22 > 99.230.69.122.59547: Flags [P.], seq 644772:644928, ack 325, win 570, length 156
20:29:02.789372 IP 159.203.27.150.22 > 99.230.69.122.59547: Flags [P.], seq 644928:645084, ack 325, win 570, length 156
20:29:02.789508 IP 159.203.27.150.22 > 99.230.69.122.59547: Flags [P.], seq 645084:645240, ack 325, win 570, length 156
20:29:02.789557 IP 159.203.27.150.22 > 99.230.69.122.59547: Flags [P.], seq 645240:645396, ack 325, win 570, length 156
20:29:02.789603 IP 159.203.27.150.22 > 99.230.69.122.59547: Flags [P.], seq 645396:645552, ack 325, win 570, length 156
20:29:02.789652 IP 159.203.27.150.22 > 99.230.69.122.59547: Flags [P.], seq 645552:645708, ack 325, win 570, length 156
20:29:02.789700 IP 159.203.27.150.22 > 99.230.69.122.59547: Flags [P.], seq 645708:645864, ack 325, win 570, length 156
20:29:02.789746 IP 159.203.27.150.22 > 99.230.69.122.59547: Flags [P.], seq 645864:646020, ack 325, win 570, length 156
20:29:02.789790 IP 159.203.27.150.22 > 99.230.69.122.59547: Flags [P.], seq 646020:646176, ack 325, win 570, length 156
20:29:02.789844 IP 159.203.27.150.22 > 99.230.69.122.59547: Flags [P.], seq 646176:646332, ack 325, win 570, length 156
20:29:02.789902 IP 159.203.27.150.22 > 99.230.69.122.59547: Flags [P.], seq 646332:646488, ack 325, win 570, length 156
20:29:02.789950 IP 159.203.27.150.22 > 99.230.69.122.59547: Flags [P.], seq 646488:646644, ack 325, win 570, length 156
20:29:02.790002 IP 159.203.27.150.22 > 99.230.69.122.59547: Flags [P.], seq 646644:646800, ack 325, win 570, length 156
20:29:02.790050 IP 159.203.27.150.22 > 99.230.69.122.59547: Flags [P.], seq 646800:646956, ack 325, win 570, length 156
20:29:02.790095 IP 159.203.27.150.22 > 99.230.69.122.59547: Flags [P.], seq 646956:647112, ack 325, win 570, length 156
20:29:02.790139 IP 159.203.27.150.22 > 99.230.69.122.59547: Flags [P.], seq 647112:647268, ack 325, win 570, length 156
20:29:02.790396 IP 159.203.27.150.22 > 99.230.69.122.59547: Flags [P.], seq 647268:647424, ack 325, win 570, length 156
20:29:02.790467 IP 159.203.27.150.22 > 99.230.69.122.59547: Flags [P.], seq 647424:647580, ack 325, win 570, length 156
20:29:02.790520 IP 159.203.27.150.22 > 99.230.69.122.59547: Flags [P.], seq 647580:647736, ack 325, win 570, length 156
20:29:02.794745 IP 99.230.69.122.59547 > 159.203.27.150.22: Flags [.], ack 606604, win 17976, length 0
20:29:02.794746 IP 99.230.69.122.59547 > 159.203.27.150.22: Flags [.], ack 607228, win 17973, length 0
20:29:02.794746 IP 99.230.69.122.59547 > 159.203.27.150.22: Flags [.], ack 607852, win 17971, length 0
20:29:02.794746 IP 99.230.69.122.59547 > 159.203.27.150.22: Flags [.], ack 608476, win 17975, length 0
20:29:02.794834 IP 159.203.27.150.22 > 99.230.69.122.59547: Flags [P.], seq 647736:647892, ack 325, win 570, length 156
20:29:02.795177 IP 159.203.27.150.22 > 99.230.69.122.59547: Flags [P.], seq 647892:648464, ack 325, win 570, length 572
20:29:02.795256 IP 159.203.27.150.22 > 99.230.69.122.59547: Flags [P.], seq 648464:648620, ack 325, win 570, length 156
20:29:02.795311 IP 159.203.27.150.22 > 99.230.69.122.59547: Flags [P.], seq 648620:648776, ack 325, win 570, length 156
20:29:02.795357 IP 159.203.27.150.22 > 99.230.69.122.59547: Flags [P.], seq 648776:648932, ack 325, win 570, length 156
20:29:02.795404 IP 159.203.27.150.22 > 99.230.69.122.59547: Flags [P.], seq 648932:649088, ack 325, win 570, length 156
20:29:02.795454 IP 159.203.27.150.22 > 99.230.69.122.59547: Flags [P.], seq 649088:649244, ack 325, win 570, length 156
20:29:02.795524 IP 159.203.27.150.22 > 99.230.69.122.59547: Flags [P.], seq 649244:649400, ack 325, win 570, length 156
20:29:02.795578 IP 159.203.27.150.22 > 99.230.69.122.59547: Flags [P.], seq 649400:649556, ack 325, win 570, length 156
20:29:02.795625 IP 159.203.27.150.22 > 99.230.69.122.59547: Flags [P.], seq 649556:649712, ack 325, win 570, length 156
20:29:02.795735 IP 159.203.27.150.22 > 99.230.69.122.59547: Flags [P.], seq 649712:649868, ack 325, win 570, length 156
20:29:02.795791 IP 159.203.27.150.22 > 99.230.69.122.59547: Flags [P.], seq 649868:650024, ack 325, win 570, length 156
20:29:02.795842 IP 159.203.27.150.22 > 99.230.69.122.59547: Flags [P.], seq 650024:650180, ack 325, win 570, length 156
20:29:02.795888 IP 159.203.27.150.22 > 99.230.69.122.59547: Flags [P.], seq 650180:650336, ack 325, win 570, length 156
20:29:02.795939 IP 159.203.27.150.22 > 99.230.69.122.59547: Flags [P.], seq 650336:650492, ack 325, win 570, length 156
20:29:02.795995 IP 159.203.27.150.22 > 99.230.69.122.59547: Flags [P.], seq 650492:650648, ack 325, win 570, length 156
20:29:02.796045 IP 159.203.27.150.22 > 99.230.69.122.59547: Flags [P.], seq 650648:650804, ack 325, win 570, length 156
20:29:02.796233 IP 159.203.27.150.22 > 99.230.69.122.59547: Flags [P.], seq 650804:650960, ack 325, win 570, length 156
20:29:02.796327 IP 159.203.27.150.22 > 99.230.69.122.59547: Flags [P.], seq 650960:651116, ack 325, win 570, length 156
20:29:02.796379 IP 159.203.27.150.22 > 99.230.69.122.59547: Flags [P.], seq 651116:651272, ack 325, win 570, length 156
20:29:02.796424 IP 159.203.27.150.22 > 99.230.69.122.59547: Flags [P.], seq 651272:651428, ack 325, win 570, length 156
20:29:02.796701 IP 159.203.27.150.22 > 99.230.69.122.59547: Flags [P.], seq 651428:651584, ack 325, win 570, length 156
20:29:02.796893 IP 99.230.69.122.59547 > 159.203.27.150.22: Flags [.], ack 609100, win 17972, length 0
20:29:02.796893 IP 99.230.69.122.59547 > 159.203.27.150.22: Flags [.], ack 609724, win 17976, length 0
20:29:02.796893 IP 99.230.69.122.59547 > 159.203.27.150.22: Flags [.], ack 610348, win 17973, length 0
20:29:02.796893 IP 99.230.69.122.59547 > 159.203.27.150.22: Flags [.], ack 610972, win 17971, length 0
20:29:02.796893 IP 99.230.69.122.59547 > 159.203.27.150.22: Flags [.], ack 616276, win 17976, length 0
20:29:02.796931 IP 159.203.27.150.22 > 99.230.69.122.59547: Flags [P.], seq 651584:651740, ack 325, win 570, length 156
20:29:02.797107 IP 159.203.27.150.22 > 99.230.69.122.59547: Flags [P.], seq 651740:652416, ack 325, win 570, length 676
20:29:02.797169 IP 159.203.27.150.22 > 99.230.69.122.59547: Flags [P.], seq 652416:652572, ack 325, win 570, length 156
20:29:02.797231 IP 159.203.27.150.22 > 99.230.69.122.59547: Flags [P.], seq 652572:652728, ack 325, win 570, length 156
20:29:02.797387 IP 159.203.27.150.22 > 99.230.69.122.59547: Flags [P.], seq 652728:652884, ack 325, win 570, length 156
20:29:02.797445 IP 159.203.27.150.22 > 99.230.69.122.59547: Flags [P.], seq 652884:653040, ack 325, win 570, length 156
20:29:02.797495 IP 159.203.27.150.22 > 99.230.69.122.59547: Flags [P.], seq 653040:653196, ack 325, win 570, length 156
20:29:02.797545 IP 159.203.27.150.22 > 99.230.69.122.59547: Flags [P.], seq 653196:653352, ack 325, win 570, length 156
20:29:02.797602 IP 159.203.27.150.22 > 99.230.69.122.59547: Flags [P.], seq 653352:653508, ack 325, win 570, length 156
20:29:02.797652 IP 159.203.27.150.22 > 99.230.69.122.59547: Flags [P.], seq 653508:653664, ack 325, win 570, length 156
20:29:02.797702 IP 159.203.27.150.22 > 99.230.69.122.59547: Flags [P.], seq 653664:653820, ack 325, win 570, length 156
20:29:02.797757 IP 159.203.27.150.22 > 99.230.69.122.59547: Flags [P.], seq 653820:653976, ack 325, win 570, length 156
20:29:02.797806 IP 159.203.27.150.22 > 99.230.69.122.59547: Flags [P.], seq 653976:654132, ack 325, win 570, length 156
20:29:02.797853 IP 159.203.27.150.22 > 99.230.69.122.59547: Flags [P.], seq 654132:654288, ack 325, win 570, length 156
20:29:02.797901 IP 159.203.27.150.22 > 99.230.69.122.59547: Flags [P.], seq 654288:654444, ack 325, win 570, length 156
20:29:02.798029 IP 159.203.27.150.22 > 99.230.69.122.59547: Flags [P.], seq 654444:654600, ack 325, win 570, length 156
20:29:02.798091 IP 159.203.27.150.22 > 99.230.69.122.59547: Flags [P.], seq 654600:654756, ack 325, win 570, length 156
20:29:02.798254 IP 159.203.27.150.22 > 99.230.69.122.59547: Flags [P.], seq 654756:654912, ack 325, win 570, length 156
20:29:02.798328 IP 159.203.27.150.22 > 99.230.69.122.59547: Flags [P.], seq 654912:655068, ack 325, win 570, length 156
20:29:02.798379 IP 159.203.27.150.22 > 99.230.69.122.59547: Flags [P.], seq 655068:655224, ack 325, win 570, length 156
20:29:02.798441 IP 159.203.27.150.22 > 99.230.69.122.59547: Flags [P.], seq 655224:655380, ack 325, win 570, length 156
20:29:02.798498 IP 159.203.27.150.22 > 99.230.69.122.59547: Flags [P.], seq 655380:655536, ack 325, win 570, length 156
20:29:02.798740 IP 159.203.27.150.22 > 99.230.69.122.59547: Flags [P.], seq 655536:655692, ack 325, win 570, length 156
20:29:02.798807 IP 159.203.27.150.22 > 99.230.69.122.59547: Flags [P.], seq 655692:655848, ack 325, win 570, length 156
20:29:02.798865 IP 159.203.27.150.22 > 99.230.69.122.59547: Flags [P.], seq 655848:656004, ack 325, win 570, length 156
20:29:02.798917 IP 159.203.27.150.22 > 99.230.69.122.59547: Flags [P.], seq 656004:656160, ack 325, win 570, length 156
20:29:02.798965 IP 159.203.27.150.22 > 99.230.69.122.59547: Flags [P.], seq 656160:656316, ack 325, win 570, length 156
20:29:02.799012 IP 159.203.27.150.22 > 99.230.69.122.59547: Flags [P.], seq 656316:656472, ack 325, win 570, length 156
20:29:02.799251 IP 159.203.27.150.22 > 99.230.69.122.59547: Flags [P.], seq 656472:656628, ack 325, win 570, length 156
20:29:02.799323 IP 159.203.27.150.22 > 99.230.69.122.59547: Flags [P.], seq 656628:656784, ack 325, win 570, length 156
20:29:02.799371 IP 159.203.27.150.22 > 99.230.69.122.59547: Flags [P.], seq 656784:656940, ack 325, win 570, length 156
20:29:02.799421 IP 159.203.27.150.22 > 99.230.69.122.59547: Flags [P.], seq 656940:657096, ack 325, win 570, length 156
20:29:02.799468 IP 159.203.27.150.22 > 99.230.69.122.59547: Flags [P.], seq 657096:657252, ack 325, win 570, length 156
20:29:02.799514 IP 159.203.27.150.22 > 99.230.69.122.59547: Flags [P.], seq 657252:657408, ack 325, win 570, length 156
20:29:02.799562 IP 159.203.27.150.22 > 99.230.69.122.59547: Flags [P.], seq 657408:657564, ack 325, win 570, length 156
20:29:02.799709 IP 159.203.27.150.22 > 99.230.69.122.59547: Flags [P.], seq 657564:657720, ack 325, win 570, length 156
20:29:02.799768 IP 159.203.27.150.22 > 99.230.69.122.59547: Flags [P.], seq 657720:657876, ack 325, win 570, length 156
20:29:02.799820 IP 159.203.27.150.22 > 99.230.69.122.59547: Flags [P.], seq 657876:658032, ack 325, win 570, length 156
20:29:02.799872 IP 159.203.27.150.22 > 99.230.69.122.59547: Flags [P.], seq 658032:658188, ack 325, win 570, length 156
20:29:02.799925 IP 159.203.27.150.22 > 99.230.69.122.59547: Flags [P.], seq 658188:658344, ack 325, win 570, length 156
20:29:02.799975 IP 159.203.27.150.22 > 99.230.69.122.59547: Flags [P.], seq 658344:658500, ack 325, win 570, length 156
20:29:02.800073 IP 159.203.27.150.22 > 99.230.69.122.59547: Flags [P.], seq 658500:658656, ack 325, win 570, length 156
20:29:02.800135 IP 159.203.27.150.22 > 99.230.69.122.59547: Flags [P.], seq 658656:658812, ack 325, win 570, length 156
20:29:02.800190 IP 159.203.27.150.22 > 99.230.69.122.59547: Flags [P.], seq 658812:658968, ack 325, win 570, length 156
20:29:02.800251 IP 159.203.27.150.22 > 99.230.69.122.59547: Flags [P.], seq 658968:659124, ack 325, win 570, length 156
20:29:02.800298 IP 159.203.27.150.22 > 99.230.69.122.59547: Flags [P.], seq 659124:659280, ack 325, win 570, length 156
20:29:02.800345 IP 159.203.27.150.22 > 99.230.69.122.59547: Flags [P.], seq 659280:659436, ack 325, win 570, length 156
20:29:02.800400 IP 99.230.69.122.59547 > 159.203.27.150.22: Flags [.], ack 620280, win 17976, length 0
20:29:02.800401 IP 99.230.69.122.59547 > 159.203.27.150.22: Flags [.], ack 622932, win 17976, length 0
20:29:02.800401 IP 99.230.69.122.59547 > 159.203.27.150.22: Flags [.], ack 629796, win 17976, length 0
20:29:02.800401 IP 99.230.69.122.59547 > 159.203.27.150.22: Flags [.], ack 631668, win 17975, length 0
20:29:02.800401 IP 99.230.69.122.59547 > 159.203.27.150.22: Flags [.], ack 635100, win 17976, length 0
20:29:02.800401 IP 99.230.69.122.59547 > 159.203.27.150.22: Flags [P.], seq 325:361, ack 635100, win 17976, length 36
20:29:02.800744 IP 159.203.27.150.22 > 99.230.69.122.59547: Flags [P.], seq 659436:659592, ack 361, win 570, length 156
20:29:02.800820 IP 159.203.27.150.22 > 99.230.69.122.59547: Flags [P.], seq 659592:660268, ack 361, win 570, length 676
20:29:02.800871 IP 159.203.27.150.22 > 99.230.69.122.59547: Flags [P.], seq 660268:660424, ack 361, win 570, length 156
20:29:02.800918 IP 159.203.27.150.22 > 99.230.69.122.59547: Flags [P.], seq 660424:660580, ack 361, win 570, length 156
20:29:02.800964 IP 159.203.27.150.22 > 99.230.69.122.59547: Flags [P.], seq 660580:660736, ack 361, win 570, length 156
20:29:02.801011 IP 159.203.27.150.22 > 99.230.69.122.59547: Flags [P.], seq 660736:660892, ack 361, win 570, length 156
20:29:02.801054 IP 159.203.27.150.22 > 99.230.69.122.59547: Flags [P.], seq 660892:661048, ack 361, win 570, length 156
20:29:02.801096 IP 159.203.27.150.22 > 99.230.69.122.59547: Flags [P.], seq 661048:661204, ack 361, win 570, length 156
20:29:02.801138 IP 159.203.27.150.22 > 99.230.69.122.59547: Flags [P.], seq 661204:661360, ack 361, win 570, length 156
